{
  "accepted_evidence_ids": [
    "mk-ev-001-apeda-market-study",
    "mk-ev-002-apeda-dashboard",
    "mk-ev-003-amazon-snapshot",
    "mk-ev-004-whole-foods-asha",
    "mk-ev-005-walmart-category",
    "mk-ev-009-food-fragility-study",
    "mk-ev-010-amazon-fees",
    "mk-ev-011-fda-importing-food",
    "mk-ev-012-fsvp",
    "mk-ev-013-fda-labeling",
    "mk-ev-014-lotus-eaters-use",
    "mk-ev-016-amazon-fba-fees"
  ],
  "contract_version": "scout-output-v1",
  "evidence_assessment": [
    {
      "disposition": "ACCEPTED",
      "evidence_id": "mk-ev-001-apeda-market-study",
      "rationale": "Accepted as observation per source."
    },
    {
      "disposition": "ACCEPTED",
      "evidence_id": "mk-ev-002-apeda-dashboard",
      "rationale": "Accepted as observation per source."
    },
    {
      "disposition": "ACCEPTED",
      "evidence_id": "mk-ev-003-amazon-snapshot",
      "rationale": "Accepted as observation per source."
    },
    {
      "disposition": "ACCEPTED",
      "evidence_id": "mk-ev-004-whole-foods-asha",
      "rationale": "Accepted as observation per source."
    },
    {
      "disposition": "ACCEPTED",
      "evidence_id": "mk-ev-005-walmart-category",
      "rationale": "Accepted as observation per source."
    },
    {
      "disposition": "UNVERIFIED",
      "evidence_id": "mk-ev-006-asha-brand",
      "rationale": "Unverified pending independent corroboration."
    },
    {
      "disposition": "UNVERIFIED",
      "evidence_id": "mk-ev-007-bihari-bites",
      "rationale": "Unverified pending supplier validation."
    },
    {
      "disposition": "UNVERIFIED",
      "evidence_id": "mk-ev-008-purnia-supplier",
      "rationale": "Unverified pending supplier validation."
    },
    {
      "disposition": "ACCEPTED",
      "evidence_id": "mk-ev-009-food-fragility-study",
      "rationale": "Accepted as verified finding."
    },
    {
      "disposition": "ACCEPTED",
      "evidence_id": "mk-ev-010-amazon-fees",
      "rationale": "Accepted as observation per source."
    },
    {
      "disposition": "ACCEPTED",
      "evidence_id": "mk-ev-011-fda-importing-food",
      "rationale": "Accepted as verified finding."
    },
    {
      "disposition": "ACCEPTED",
      "evidence_id": "mk-ev-012-fsvp",
      "rationale": "Accepted as verified finding."
    },
    {
      "disposition": "ACCEPTED",
      "evidence_id": "mk-ev-013-fda-labeling",
      "rationale": "Accepted as verified finding."
    },
    {
      "disposition": "ACCEPTED",
      "evidence_id": "mk-ev-014-lotus-eaters-use",
      "rationale": "Accepted as observation per source."
    },
    {
      "disposition": "UNVERIFIED",
      "evidence_id": "mk-ev-015-name-screen",
      "rationale": "Unverified pending comprehensive trademark search."
    },
    {
      "disposition": "ACCEPTED",
      "evidence_id": "mk-ev-016-amazon-fba-fees",
      "rationale": "Accepted as observation per source."
    }
  ],
  "missing_evidence": [],
  "product_family_id": "product-001",
  "rejected_evidence_ids": [],
  "role": "Scout",
  "status": "SUCCESS",
  "summary": "Evidence review completed: 12 accepted observations/findings, 4 unverified observations/inferences, no rejected evidence, and no missing evidence.",
  "unresolved_factual_gaps": [],
  "unverified_evidence_ids": [
    "mk-ev-006-asha-brand",
    "mk-ev-007-bihari-bites",
    "mk-ev-008-purnia-supplier",
    "mk-ev-015-name-screen"
  ]
}
